{
  "$schema": "./key-figures.schema.json",
  "version": "1.0.0",
  "lastUpdated": "2026-05-08",
  "owner": "Genia Chicherova, ECCE Project Manager, IARC",
  "figures": [
    {
      "id": "partner_institutes",
      "label_en": "Partner institutes",
      "label_fr": "Instituts partenaires",
      "label_es": "Institutos asociados",
      "value": 36,
      "unit": null,
      "display": "exact",
      "asOf": "2026-05-08",
      "category": "scope",
      "source": { "label": "ECCE consortium register (WP5)" },
      "owner": "Genia Chicherova, IARC",
      "showOn": ["/", "/partner-institutes", "/about"],
      "notes": "Counted from website source document 8 May 2026: Africa 4, Asia 5, Europe 14, North America 4, South America 9 = 36."
    },
    {
      "id": "countries",
      "label_en": "Countries represented",
      "label_fr": "Pays représentés",
      "label_es": "Países representados",
      "value": 27,
      "unit": null,
      "display": "exact",
      "asOf": "2026-05-08",
      "category": "scope",
      "source": { "label": "ECCE consortium register (WP5)" },
      "owner": "Genia Chicherova, IARC",
      "showOn": ["/", "/partner-institutes", "/about"],
      "notes": "Africa: Egypt, Nigeria, Tanzania, Uganda. Asia: Japan, Pakistan, South Korea, Thailand, Vietnam. Europe: Denmark, UK, France, Germany, Italy, Spain, Ireland, Latvia, Netherlands, Poland, Russia. North America: Canada, USA. South America: Argentina, Brazil, Chile, Uruguay, Colombia."
    },
    {
      "id": "continents",
      "label_en": "Continents",
      "value": 5,
      "unit": null,
      "display": "exact",
      "asOf": "2026-05-08",
      "category": "scope",
      "source": { "label": "ECCE consortium register (WP5)" },
      "owner": "Genia Chicherova, IARC",
      "showOn": ["/", "/partner-institutes"]
    },
    {
      "id": "individuals_enrolled",
      "label_en": "Individuals enrolled",
      "label_fr": "Individus inclus",
      "label_es": "Individuos inscritos",
      "value": 3700,
      "unit": "+",
      "display": "approx",
      "asOf": "2026-05-08",
      "category": "samples",
      "source": { "label": "WP1 enrollment register" },
      "owner": "Paul Brennan / Genia Chicherova, IARC (WP1 lead)",
      "showOn": ["/", "/about", "/research/wp1-epidemiology"],
      "notes": "Source document states 'more than 3,700 individuals across Europe, North and South America, and Asia'."
    },
    {
      "id": "wgs_target",
      "label_en": "Whole genome sequences (target)",
      "label_fr": "Génomes entiers séquencés (objectif)",
      "value": 12400,
      "unit": null,
      "display": "target",
      "asOf": "2026-05-08",
      "category": "genomics",
      "source": { "label": "WP2 work-package plan" },
      "owner": "Sir Mike Stratton, Wellcome Sanger Institute (WP2 lead)",
      "showOn": ["/", "/about", "/research/wp2-genomics"],
      "notes": "Includes 2,400 early-onset and later-onset colorectal cancers, plus 7,000 normal colorectal crypts."
    },
    {
      "id": "early_onset_genomes_target",
      "label_en": "Early- and later-onset CRC genomes (target)",
      "value": 2400,
      "unit": null,
      "display": "target",
      "asOf": "2026-05-08",
      "category": "genomics",
      "source": { "label": "WP2 work-package plan" },
      "owner": "Sir Mike Stratton, Wellcome Sanger Institute (WP2 lead)",
      "showOn": ["/research/wp2-genomics"]
    },
    {
      "id": "normal_crypts_target",
      "label_en": "Normal colorectal crypts (target)",
      "label_fr": "Cryptes colorectales normales (objectif)",
      "value": 7000,
      "unit": null,
      "display": "target",
      "asOf": "2026-05-08",
      "category": "genomics",
      "source": { "label": "WP2 work-package plan" },
      "owner": "Sir Mike Stratton, Wellcome Sanger Institute (WP2 lead)",
      "showOn": ["/research/wp2-genomics", "/about"]
    },
    {
      "id": "work_packages",
      "label_en": "Work packages",
      "label_fr": "Lots de travail",
      "label_es": "Paquetes de trabajo",
      "value": 5,
      "unit": null,
      "display": "exact",
      "asOf": "2026-05-08",
      "category": "scope",
      "source": { "label": "ECCE project plan" },
      "owner": "Paul Brennan, IARC (Project lead)",
      "showOn": ["/", "/research", "/about"]
    },
    {
      "id": "principal_investigators",
      "label_en": "Principal Investigators",
      "label_fr": "Chercheurs principaux",
      "value": 4,
      "unit": null,
      "display": "exact",
      "asOf": "2026-05-08",
      "category": "team",
      "source": { "label": "ECCE leadership team" },
      "owner": "Genia Chicherova, IARC",
      "showOn": ["/team", "/about"],
      "notes": "Paul Brennan (IARC), Sir Mike Stratton (Sanger), Trevor Lawley (Sanger), Ludmil Alexandrov (UCSD)."
    },
    {
      "id": "ecce_core_team",
      "label_en": "ECCE core team members",
      "value": 13,
      "unit": null,
      "display": "exact",
      "asOf": "2026-05-08",
      "category": "team",
      "source": { "label": "Source document team list (Sanger 5 + IARC 7 + UCSD 1)" },
      "owner": "Genia Chicherova, IARC",
      "showOn": ["/team"],
      "notes": "Sanger: Humphreys, Latimer, Moody, Ramos, Wyvekens. IARC: Abedi-Ardekani, Chicherova, Gaborieau, Carreira, Chopard, Cattiaux, Perdomo. UCSD: Steele."
    },
    {
      "id": "partner_lead_investigators",
      "label_en": "Partner lead investigators",
      "value": 50,
      "unit": "+",
      "display": "approx",
      "asOf": "2026-05-08",
      "category": "team",
      "source": { "label": "Counted from partner-institute register" },
      "owner": "Genia Chicherova, IARC",
      "showOn": ["/team", "/partner-institutes"],
      "notes": "Some institutes list multiple lead investigators; conservative count ~50."
    },
    {
      "id": "publications_count",
      "label_en": "Peer-reviewed publications",
      "value": 0,
      "unit": null,
      "display": "exact",
      "asOf": "2026-05-08",
      "category": "publications",
      "source": { "label": "ECCE publications register" },
      "owner": "Genia Chicherova, IARC",
      "showOn": ["/news/publications"],
      "isPublic": false,
      "notes": "Hidden until first ECCE publication ships. Toggle isPublic=true at that point."
    },
    {
      "id": "meetings_count",
      "label_en": "Consortium meetings to date",
      "value": 0,
      "unit": null,
      "display": "exact",
      "asOf": "2026-05-08",
      "category": "meetings",
      "source": { "label": "ECCE meetings register" },
      "owner": "Genia Chicherova, IARC",
      "showOn": ["/news/meetings"],
      "isPublic": false,
      "notes": "Increment after each formal consortium meeting (next: 18 May 2026). Toggle isPublic=true after that meeting."
    },
    {
      "id": "funding_source",
      "label_en": "Funded by",
      "label_fr": "Financé par",
      "value": 1,
      "unit": null,
      "display": "exact",
      "asOf": "2026-05-08",
      "category": "scope",
      "source": { "label": "European Research Council Synergy Grant" },
      "owner": "Paul Brennan, IARC",
      "showOn": ["/about"],
      "notes": "Display as text label, not a number. Codex: render this card with a label-only variant."
    }
  ]
}
